{
  "fixture": 1,
  "name": "second-factor",
  "description": "The sign-in still owes a second factor",
  "subject": "exchange",
  "input": {
    "request": {
      "method": "POST",
      "path": "/v1/auth/native/exchange",
      "headers": {
        "X-Client-App": "com.marketcanopy.office",
        "X-Client-Platform": "linux",
        "X-Client-Version": "10.0.0.3",
        "X-Device-Id": "4f7d2c1e-8a8b-4c39-9d7e-2b1f5a0c9e11"
      },
      "schema": "native-exchange-request",
      "body": {
        "code": "ZXhhbXBsZS1jb2RlLW5vdC1yZWFsLTAwMDAwMDAwMDE",
        "codeVerifier": "example-verifier-not-real-aaaaaaaaaaaaaaaaaaaaaaaaaaaaaa"
      }
    },
    "response": {
      "status": 200,
      "body": {
        "success": true,
        "data": {
          "mfaRequired": true,
          "mfaToken": "<mfa challenge token>",
          "methods": [
            "totp"
          ]
        },
        "meta": {
          "timestamp": "2026-10-24T21:40:00.000Z",
          "requestId": "req_example"
        }
      },
      "schema": "native-exchange-response"
    }
  },
  "expect": {
    "outcome": "ok"
  }
}
