{
  "fixture": 1,
  "name": "bom",
  "description": "A BOM makes it unreadable",
  "subject": "credential-read",
  "input": {
    "raw": "﻿{\"version\":1,\"apiOrigin\":\"https://api.marketcanopy.com\",\"userId\":\"66f0c0ffee0000000000a001\",\"deviceSessionId\":\"66f0c0ffee0000000000d001\",\"installationId\":\"4f7d2c1e-8a8b-4c39-9d7e-2b1f5a0c9e11\",\"refreshToken\":\"dsr_EXAMPLE-not-a-real-refresh-token-0001\",\"issuedAt\":\"2026-10-24T21:40:00.000Z\",\"writtenBy\":\"desktop\",\"lastActiveOrganizationId\":\"66f0c0ffee0000000000b001\"}",
    "apiOrigin": "https://api.marketcanopy.com"
  },
  "expect": {
    "state": "absent",
    "reason": "unreadable"
  }
}
