{
  "fixture": 1,
  "name": "fragment",
  "description": "A fragment",
  "subject": "deep-link",
  "input": "mc-office://open|n|Budget|https://app.marketcanopy.com/office/documents/66f0c0ffee0000000000c001?organizationId=66f0c0ffee0000000000b001#x",
  "expect": {
    "ok": false,
    "error": "INVALID_LINK"
  }
}
