{
  "fixture": 1,
  "name": "credential-link",
  "description": "A link carrying a token is refused as a credential",
  "subject": "launch-args",
  "input": [
    "mc-office://open|n|Quarterly%20plan|https://app.marketcanopy.com/office/documents/66f0c0ffee0000000000c001?organizationId=66f0c0ffee0000000000b001&token=abc"
  ],
  "expect": {
    "ok": false,
    "error": "CREDENTIAL_IN_LINK",
    "index": 0
  }
}
